{"applicationId":"org.nginx.nginx","capabilitySequence":["manifest.verify","health.check","volume.backup","health.check"],"operation":"backup","parameterContracts":[{"capability":"manifest.verify","fixedParameters":{"requireReviewState":"signed"},"requiredParameters":["manifestDigest","requireReviewState"]},{"capability":"health.check","fixedParameters":{"target":"http://127.0.0.1:18080/"},"requiredParameters":["target"]},{"capability":"volume.backup","fixedParameters":{"volume":"config"},"requiredParameters":["volume","backupId"]}],"procedureId":"proc_backup_nginx","provenance":{"applicationScope":"org.nginx.nginx","authorityLevel":"wazi-reviewed","confidence":0.95,"contentHash":"sha256:4f77b5fe6bef815fab0086e5f8689b9a9fee1df7451bb337fb95885d71438a0f","expiresAt":"2026-11-07T12:16:12Z","extractionMethod":"deterministic-parser","observedAt":"2026-10-31T12:16:12Z","sensitivity":"public","sourceId":"https://github.com/nginx/docker-nginx/blob/d99174e2cecfc7e5db51c05aff54c2c9dee45803/stable/debian/Dockerfile","sourceType":"dockerfile","versionScope":"1.30.6+wazi.1"},"requiresCheckpoint":false,"reviewState":"signed","schemaVersion":"1.0.0","signature":{"algorithm":"sigstore-cosign","payloadDigest":"sha256:e9c8dfb4e53eecbb46a85c16e50f59ea2c862bd627c7a753555cf2e941c2ed92","signedAt":"2026-10-31T12:16:13Z","signedBy":"wazi-phase1-demo-pilot-20261030","value":"MEYCIQDcId7F3eBXZiElzjNw/E0+QpKCYbLhB//eYXuN/vjw2QIhANHnQB+5pJylhGguHg7oNknKdlsd6jtZu7nnx/wlkYzB"},"version":"1.0.0"}