{"applicationId":"org.gitea.gitea","capabilitySequence":["manifest.verify","compose.down"],"operation":"uninstall","parameterContracts":[{"capability":"manifest.verify","requiredParameters":["manifestDigest","requireReviewState"]},{"capability":"compose.down","requiredParameters":["service","projectName"]}],"procedureId":"proc_gitea_uninstall_28_1_0","provenance":{"applicationScope":"org.gitea.gitea","authorityLevel":"wazi-reviewed","confidence":1.0,"contentHash":"sha256:85f2a98752fd272eca597739a5984cdf1cc50586c9dad889dd8476e69fc3eaf4","extractionMethod":"deterministic-parser","observedAt":"2026-10-30T19:44:49Z","sensitivity":"public","sourceId":"src_gitea_v28_1_0","sourceType":"container-registry","versionScope":"28.1.0+wazipilot.2"},"requiresCheckpoint":false,"reviewState":"signed","schemaVersion":"1.0.0","signature":{"algorithm":"sigstore-cosign","payloadDigest":"sha256:eefd22022fb6b05c227788ba5459a93f1d18e79c22709763e1c4fa1c4475b8f0","signedAt":"2026-10-30T19:44:56Z","signedBy":"wazi-phase1-demo-pilot-20261030","value":"MEYCIQCt+6axtYTcffsUDk/Wr0U7ma/Mkxc65x8O91qx9w4kCAIhAIxrw+K+ETtnnR2Rpocwk+dOuaLNh/P5jynGD5moctgi"},"version":"1.0.0"}