{"applicationId":"com.mysql.mysql","capabilitySequence":["manifest.verify","compose.pull","compose.up","health.check"],"operation":"upgrade","parameterContracts":[{"capability":"manifest.verify","fixedParameters":{"requireReviewState":"signed"},"requiredParameters":["manifestDigest","requireReviewState"]},{"capability":"compose.pull","fixedParameters":{"imageDigest":"sha256:c7069b8ee2659633a89044c8697e626d9b8f36b4fdede18511aae749ad714d7c","service":"mysql"},"requiredParameters":["service","imageDigest"]},{"capability":"compose.up","fixedParameters":{"service":"mysql"},"requiredParameters":["service","projectName","composeArtifactDigest"]},{"capability":"health.check","fixedParameters":{"target":"mysql://local/wazi"},"requiredParameters":["target"]}],"procedureId":"proc_upgrade_mysql","provenance":{"applicationScope":"com.mysql.mysql","authorityLevel":"wazi-reviewed","confidence":0.95,"contentHash":"sha256:22342d45458ef2e490fe21a169060e2dc765a79931978e241092ecb902427897","expiresAt":"2026-11-07T12:16:09Z","extractionMethod":"deterministic-parser","observedAt":"2026-10-31T12:16:09Z","sensitivity":"public","sourceId":"https://github.com/docker-library/mysql/blob/9b6c81572125a4ff828e3037c71940f3f8311978/8.4/Dockerfile.oracle","sourceType":"dockerfile","versionScope":"8.4.13+wazi.1"},"requiresCheckpoint":false,"reviewState":"signed","schemaVersion":"1.0.0","signature":{"algorithm":"sigstore-cosign","payloadDigest":"sha256:e4e7f6f6697035282dd01325f4f5c30d45e275339606c3cc948e585a0ccd093d","signedAt":"2026-10-31T12:16:12Z","signedBy":"wazi-phase1-demo-pilot-20261030","value":"MEUCIApARFRH5tUbDcYYFCydYNTivD8/PWBBKwInVrYKqeXWAiEA8BXfBqTp06y5SLRtruU1q5Uu2IuQDs7FsFcUeYw81Pg="},"version":"1.0.0"}