{"applicationId":"org.gitea.gitea","capabilitySequence":["manifest.verify","compose.pull","compose.up","health.check"],"operation":"install","parameterContracts":[{"capability":"manifest.verify","requiredParameters":["manifestDigest","requireReviewState"]},{"capability":"compose.pull","requiredParameters":["service","imageDigest"]},{"capability":"compose.up","requiredParameters":["service","projectName","composeArtifactDigest"]},{"capability":"health.check","requiredParameters":["target"]}],"procedureId":"proc_gitea_install_28_1_0","provenance":{"applicationScope":"org.gitea.gitea","authorityLevel":"wazi-reviewed","confidence":1.0,"contentHash":"sha256:85f2a98752fd272eca597739a5984cdf1cc50586c9dad889dd8476e69fc3eaf4","extractionMethod":"deterministic-parser","observedAt":"2026-10-30T19:44:49Z","sensitivity":"public","sourceId":"src_gitea_v28_1_0","sourceType":"container-registry","versionScope":"28.1.0+wazipilot.2"},"requiresCheckpoint":false,"reviewState":"signed","schemaVersion":"1.0.0","signature":{"algorithm":"sigstore-cosign","payloadDigest":"sha256:b4bd2309c535ebd19abe07e6a81c01415b78de734442212a5414cefd216ddb9f","signedAt":"2026-10-30T19:44:54Z","signedBy":"wazi-phase1-demo-pilot-20261030","value":"MEYCIQD0/ZBPInDB8KGM5srZfMsa11IUQ9+wS+UJrNewg0uwYAIhAOhYxYOJa3uWnT3FP5JHa1sOa0DiO5mCuPjhm2k0Ijia"},"version":"1.0.0"}