{"applicationId":"org.gitea.gitea","capabilitySequence":["manifest.verify","volume.backup","volume.backup"],"operation":"backup","parameterContracts":[{"capability":"manifest.verify","requiredParameters":["manifestDigest","requireReviewState"]},{"capability":"volume.backup","requiredParameters":["volume","backupId"]}],"procedureId":"proc_gitea_backup_28_1_0","provenance":{"applicationScope":"org.gitea.gitea","authorityLevel":"wazi-reviewed","confidence":1.0,"contentHash":"sha256:85f2a98752fd272eca597739a5984cdf1cc50586c9dad889dd8476e69fc3eaf4","extractionMethod":"deterministic-parser","observedAt":"2026-10-30T19:44:49Z","sensitivity":"public","sourceId":"src_gitea_v28_1_0","sourceType":"container-registry","versionScope":"28.1.0+wazipilot.2"},"requiresCheckpoint":false,"reviewState":"signed","schemaVersion":"1.0.0","signature":{"algorithm":"sigstore-cosign","payloadDigest":"sha256:5dff6a7886671e4d3067dd95e6aa23034ee18747d5a6124a576786eb9ec7f32e","signedAt":"2026-10-30T19:44:53Z","signedBy":"wazi-phase1-demo-pilot-20261030","value":"MEQCIDMZzrobi1hFK4e+6yDNSGmv6fFiu5nDnGku5zLaYC7hAiB5BbcLuAeov41srT5aJKPWoWCZCtjxeaVbL+xpsav9nQ=="},"version":"1.0.0"}