{"applicationId":"org.gitea.gitea","capabilitySequence":["manifest.verify","health.check"],"operation":"health-check","parameterContracts":[{"capability":"manifest.verify","requiredParameters":["manifestDigest","requireReviewState"]},{"capability":"health.check","requiredParameters":["target"]}],"procedureId":"proc_gitea_health_check_28_2_0","provenance":{"applicationScope":"org.gitea.gitea","authorityLevel":"wazi-reviewed","confidence":1.0,"contentHash":"sha256:3a4e1aa4a885b287effc03e33fc990ddd6ac68364c98203267bc1e7711a534f8","extractionMethod":"deterministic-parser","observedAt":"2026-10-30T19:44:49Z","sensitivity":"public","sourceId":"src_gitea_v28_2_0","sourceType":"container-registry","versionScope":"28.2.0+wazipilot.2"},"requiresCheckpoint":false,"reviewState":"signed","schemaVersion":"1.0.0","signature":{"algorithm":"sigstore-cosign","payloadDigest":"sha256:946106e274329d80b77d8720e71bde17a8fe57bf2c0c586240d7ef270d077ed8","signedAt":"2026-10-30T19:44:58Z","signedBy":"wazi-phase1-demo-pilot-20261030","value":"MEUCIQD68SddSL42jMUtNxAlRXqgsI4rgeAI7i6Zv/oYsY/MtgIgP1ybDET4+35RIPvYMmmwSCRINQcXPJBwRw1kUOH/x+s="},"version":"1.0.0"}