{"applicationId":"org.gitea.gitea","capabilitySequence":["manifest.verify","compose.up","health.check"],"operation":"rollback","parameterContracts":[{"capability":"manifest.verify","requiredParameters":["manifestDigest","requireReviewState"]},{"capability":"compose.up","requiredParameters":["service","projectName","composeArtifactDigest"]},{"capability":"health.check","requiredParameters":["target"]}],"procedureId":"proc_gitea_rollback_28_2_0","provenance":{"applicationScope":"org.gitea.gitea","authorityLevel":"wazi-reviewed","confidence":1.0,"contentHash":"sha256:3a4e1aa4a885b287effc03e33fc990ddd6ac68364c98203267bc1e7711a534f8","extractionMethod":"deterministic-parser","observedAt":"2026-10-30T19:44:49Z","sensitivity":"public","sourceId":"src_gitea_v28_2_0","sourceType":"container-registry","versionScope":"28.2.0+wazipilot.2"},"requiresCheckpoint":true,"reviewState":"signed","schemaVersion":"1.0.0","signature":{"algorithm":"sigstore-cosign","payloadDigest":"sha256:b6f9295e282275296548366662f24bff0f289b5dc3dcdf1c1d17fb193fb5a719","signedAt":"2026-10-30T19:44:59Z","signedBy":"wazi-phase1-demo-pilot-20261030","value":"MEQCIHZhniYBvXFCWhAvwITaGPLuqgyVaVaJEm6uar5vUNPcAiARw2+u1cteDdvtrEApblhQIptphUVYjH6qlf2Kv0M09g=="},"version":"1.0.0"}