{"applicationId":"org.nginx.nginx","capabilitySequence":["manifest.verify","volume.restore","compose.up","health.check"],"operation":"restore","parameterContracts":[{"capability":"manifest.verify","fixedParameters":{"requireReviewState":"signed"},"requiredParameters":["manifestDigest","requireReviewState"]},{"capability":"volume.restore","fixedParameters":{"volume":"config"},"requiredParameters":["volume","backupId"]},{"capability":"compose.up","fixedParameters":{"service":"nginx"},"requiredParameters":["service","projectName","composeArtifactDigest"]},{"capability":"health.check","fixedParameters":{"target":"http://127.0.0.1:18080/"},"requiredParameters":["target"]}],"procedureId":"proc_restore_nginx","provenance":{"applicationScope":"org.nginx.nginx","authorityLevel":"wazi-reviewed","confidence":0.95,"contentHash":"sha256:4f77b5fe6bef815fab0086e5f8689b9a9fee1df7451bb337fb95885d71438a0f","expiresAt":"2026-11-07T12:16:12Z","extractionMethod":"deterministic-parser","observedAt":"2026-10-31T12:16:12Z","sensitivity":"public","sourceId":"https://github.com/nginx/docker-nginx/blob/d99174e2cecfc7e5db51c05aff54c2c9dee45803/stable/debian/Dockerfile","sourceType":"dockerfile","versionScope":"1.30.6+wazi.1"},"requiresCheckpoint":true,"reviewState":"signed","schemaVersion":"1.0.0","signature":{"algorithm":"sigstore-cosign","payloadDigest":"sha256:89bb1636e5d0aa740904daeda2e2e2880b9b99b2210c0479e613aaeda5bbe9dd","signedAt":"2026-10-31T12:16:14Z","signedBy":"wazi-phase1-demo-pilot-20261030","value":"MEUCICnhq1TZyqsuyGB2n1umr286fQkYRVe7B7orEW0Wel6qAiEA21BQBYiJstzmFhBeeCWP1TcDk8APHZ2rEYfgYxgGzkI="},"version":"1.0.0"}