{"applicationId":"org.nginx.nginx","capabilitySequence":["manifest.verify","compose.down"],"operation":"uninstall","parameterContracts":[{"capability":"manifest.verify","fixedParameters":{"requireReviewState":"signed"},"requiredParameters":["manifestDigest","requireReviewState"]},{"capability":"compose.down","fixedParameters":{"removeVolumes":false,"service":"nginx"},"requiredParameters":["service","projectName","removeVolumes"]}],"procedureId":"proc_uninstall_nginx","provenance":{"applicationScope":"org.nginx.nginx","authorityLevel":"wazi-reviewed","confidence":0.95,"contentHash":"sha256:4f77b5fe6bef815fab0086e5f8689b9a9fee1df7451bb337fb95885d71438a0f","expiresAt":"2026-11-07T12:16:12Z","extractionMethod":"deterministic-parser","observedAt":"2026-10-31T12:16:12Z","sensitivity":"public","sourceId":"https://github.com/nginx/docker-nginx/blob/d99174e2cecfc7e5db51c05aff54c2c9dee45803/stable/debian/Dockerfile","sourceType":"dockerfile","versionScope":"1.30.6+wazi.1"},"requiresCheckpoint":false,"reviewState":"signed","schemaVersion":"1.0.0","signature":{"algorithm":"sigstore-cosign","payloadDigest":"sha256:2c1e3fda02eb21d14de9f021e65b7b464365a63efbb22d0957dec900a059d623","signedAt":"2026-10-31T12:16:15Z","signedBy":"wazi-phase1-demo-pilot-20261030","value":"MEYCIQDLmDCWPCQSd4WKRHy299l7BBDFoIyhwGNVY9M0Ey/ZugIhAO+wEG/s/almX3mFQxCfKY3ctAU4qAacHVGc+k5jmLPY"},"version":"1.0.0"}