{"applicationId":"com.mysql.mysql","capabilitySequence":["manifest.verify","health.check","volume.backup","health.check"],"operation":"backup","parameterContracts":[{"capability":"manifest.verify","fixedParameters":{"requireReviewState":"signed"},"requiredParameters":["manifestDigest","requireReviewState"]},{"capability":"health.check","fixedParameters":{"target":"mysql://local/wazi"},"requiredParameters":["target"]},{"capability":"volume.backup","fixedParameters":{"volume":"data"},"requiredParameters":["volume","backupId"]}],"procedureId":"proc_backup_mysql","provenance":{"applicationScope":"com.mysql.mysql","authorityLevel":"wazi-reviewed","confidence":0.95,"contentHash":"sha256:22342d45458ef2e490fe21a169060e2dc765a79931978e241092ecb902427897","expiresAt":"2026-11-07T12:16:09Z","extractionMethod":"deterministic-parser","observedAt":"2026-10-31T12:16:09Z","sensitivity":"public","sourceId":"https://github.com/docker-library/mysql/blob/9b6c81572125a4ff828e3037c71940f3f8311978/8.4/Dockerfile.oracle","sourceType":"dockerfile","versionScope":"8.4.13+wazi.1"},"requiresCheckpoint":false,"reviewState":"signed","schemaVersion":"1.0.0","signature":{"algorithm":"sigstore-cosign","payloadDigest":"sha256:68dd38c1669e37d68ee16b8789aa06bb49a2a1b9f7711f82ba6370030612d4ac","signedAt":"2026-10-31T12:16:10Z","signedBy":"wazi-phase1-demo-pilot-20261030","value":"MEYCIQCJDVYLIfH9FKOe+LBf8HT0QlmHag0jSkmDFlzwBzrFsgIhAP4R+TQ2463VQiN/v03hQryTzOiIIOzUHclOENqrH+JG"},"version":"1.0.0"}