{"applicationId":"org.gitea.gitea","capabilitySequence":["manifest.verify","volume.backup","compose.pull","compose.up","health.check"],"operation":"upgrade","parameterContracts":[{"capability":"manifest.verify","requiredParameters":["manifestDigest","requireReviewState"]},{"capability":"volume.backup","requiredParameters":["volume","backupId"]},{"capability":"compose.pull","requiredParameters":["service","imageDigest"]},{"capability":"compose.up","requiredParameters":["service","projectName","composeArtifactDigest"]},{"capability":"health.check","requiredParameters":["target"]}],"procedureId":"proc_gitea_upgrade_28_1_0","provenance":{"applicationScope":"org.gitea.gitea","authorityLevel":"wazi-reviewed","confidence":1.0,"contentHash":"sha256:85f2a98752fd272eca597739a5984cdf1cc50586c9dad889dd8476e69fc3eaf4","extractionMethod":"deterministic-parser","observedAt":"2026-10-30T19:44:49Z","sensitivity":"public","sourceId":"src_gitea_v28_1_0","sourceType":"container-registry","versionScope":"28.1.0+wazipilot.2"},"requiresCheckpoint":true,"reviewState":"signed","schemaVersion":"1.0.0","signature":{"algorithm":"sigstore-cosign","payloadDigest":"sha256:dd679fcca7ea24a8c598998d9a20c644a680013ec1b209f1c59cfdc8aa55c98b","signedAt":"2026-10-30T19:44:56Z","signedBy":"wazi-phase1-demo-pilot-20261030","value":"MEUCIEn+NwvduRlnjlgFIGVJ7xX2OTPziyapR9WpAPzW1rCnAiEA9APjZnH343b7F8MzCAjXXJfpGIdmURxa//AzZmgrzEk="},"version":"1.0.0"}