{"applicationId":"org.nginx.nginx","capabilitySequence":["manifest.verify","compose.pull","compose.up","health.check"],"operation":"upgrade","parameterContracts":[{"capability":"manifest.verify","fixedParameters":{"requireReviewState":"signed"},"requiredParameters":["manifestDigest","requireReviewState"]},{"capability":"compose.pull","fixedParameters":{"imageDigest":"sha256:4af8905e88cbbf8f2ca3e5a28955247e8e6f41ccdd44e480a64ba1861aa13fba","service":"nginx"},"requiredParameters":["service","imageDigest"]},{"capability":"compose.up","fixedParameters":{"service":"nginx"},"requiredParameters":["service","projectName","composeArtifactDigest"]},{"capability":"health.check","fixedParameters":{"target":"http://127.0.0.1:18080/"},"requiredParameters":["target"]}],"procedureId":"proc_upgrade_nginx","provenance":{"applicationScope":"org.nginx.nginx","authorityLevel":"wazi-reviewed","confidence":0.95,"contentHash":"sha256:4f77b5fe6bef815fab0086e5f8689b9a9fee1df7451bb337fb95885d71438a0f","expiresAt":"2026-11-07T12:16:12Z","extractionMethod":"deterministic-parser","observedAt":"2026-10-31T12:16:12Z","sensitivity":"public","sourceId":"https://github.com/nginx/docker-nginx/blob/d99174e2cecfc7e5db51c05aff54c2c9dee45803/stable/debian/Dockerfile","sourceType":"dockerfile","versionScope":"1.30.6+wazi.1"},"requiresCheckpoint":false,"reviewState":"signed","schemaVersion":"1.0.0","signature":{"algorithm":"sigstore-cosign","payloadDigest":"sha256:6b01b60bb31c2c204f6a3188eb56b78520326dbcc97a54aadc21f06942706e3e","signedAt":"2026-10-31T12:16:15Z","signedBy":"wazi-phase1-demo-pilot-20261030","value":"MEUCID42APrBI4VU5HPWJ3FJFP3d/PFQKUXeiJJ+Jj7O7GKdAiEAnHS9O9XXpAH1IGBvjSvFGYpo95WyUYIj4RRfZFK5Dng="},"version":"1.0.0"}