{"applicationId":"com.mysql.mysql","capabilitySequence":["manifest.verify","health.check","volume.restore","health.check"],"operation":"restore","parameterContracts":[{"capability":"manifest.verify","fixedParameters":{"requireReviewState":"signed"},"requiredParameters":["manifestDigest","requireReviewState"]},{"capability":"health.check","fixedParameters":{"target":"mysql://local/wazi"},"requiredParameters":["target"]},{"capability":"volume.restore","fixedParameters":{"volume":"data"},"requiredParameters":["volume","backupId"]}],"procedureId":"proc_restore_mysql","provenance":{"applicationScope":"com.mysql.mysql","authorityLevel":"wazi-reviewed","confidence":0.95,"contentHash":"sha256:22342d45458ef2e490fe21a169060e2dc765a79931978e241092ecb902427897","expiresAt":"2026-11-07T12:16:09Z","extractionMethod":"deterministic-parser","observedAt":"2026-10-31T12:16:09Z","sensitivity":"public","sourceId":"https://github.com/docker-library/mysql/blob/9b6c81572125a4ff828e3037c71940f3f8311978/8.4/Dockerfile.oracle","sourceType":"dockerfile","versionScope":"8.4.13+wazi.1"},"requiresCheckpoint":true,"reviewState":"signed","schemaVersion":"1.0.0","signature":{"algorithm":"sigstore-cosign","payloadDigest":"sha256:4d35bf5a58a87987eb40a456da9b7527b58fec423eb3d676e98055f0369bd052","signedAt":"2026-10-31T12:16:11Z","signedBy":"wazi-phase1-demo-pilot-20261030","value":"MEQCIFIdzfBWnMXndNWpt6cLFPo46B+uBjBwfqlOeumx16OwAiB07yXroO22H3HXcgYtsfZvAQDtwmqo2Xwb2lHbrSr7lQ=="},"version":"1.0.0"}