{"applicationId":"org.postgresql.postgresql","capabilitySequence":["manifest.verify","health.check","volume.restore","health.check"],"operation":"restore","parameterContracts":[{"capability":"manifest.verify","fixedParameters":{"requireReviewState":"signed"},"requiredParameters":["manifestDigest","requireReviewState"]},{"capability":"health.check","fixedParameters":{"target":"postgresql://local/wazi"},"requiredParameters":["target"]},{"capability":"volume.restore","fixedParameters":{"volume":"data"},"requiredParameters":["volume","backupId"]}],"procedureId":"proc_restore_postgresql","provenance":{"applicationScope":"org.postgresql.postgresql","authorityLevel":"wazi-reviewed","confidence":0.95,"contentHash":"sha256:bbd3cbb45a19023ce9d9b87ac3d965d5ff7da29ef7c2846b2cd7173a2caae3f7","expiresAt":"2026-11-07T12:16:04Z","extractionMethod":"deterministic-parser","observedAt":"2026-10-31T12:16:04Z","sensitivity":"public","sourceId":"https://github.com/docker-library/postgres/blob/dfc76bb299b057785026eb2eea39556b6fe52983/17/bookworm/Dockerfile","sourceType":"dockerfile","versionScope":"17.11.0+wazi.1"},"requiresCheckpoint":true,"reviewState":"signed","schemaVersion":"1.0.0","signature":{"algorithm":"sigstore-cosign","payloadDigest":"sha256:2cb246cfb561cf34a30a66d266642d27d507b86045556bed8090a50230987b3f","signedAt":"2026-10-31T12:16:07Z","signedBy":"wazi-phase1-demo-pilot-20261030","value":"MEQCIHuUPkeuSqSoPqbf6lz+hviL9ZBOEJkhtwcdlzLVsoAAAiBo2x97fXc8tKB1or0TWIMR2uZZCj0/y7S48hLMPihgUg=="},"version":"1.0.0"}