{"applicationId":"org.postgresql.postgresql","capabilitySequence":["manifest.verify","compose.down"],"operation":"uninstall","parameterContracts":[{"capability":"manifest.verify","fixedParameters":{"requireReviewState":"signed"},"requiredParameters":["manifestDigest","requireReviewState"]},{"capability":"compose.down","fixedParameters":{"removeVolumes":false,"service":"postgresql"},"requiredParameters":["service","projectName","removeVolumes"]}],"procedureId":"proc_uninstall_postgresql","provenance":{"applicationScope":"org.postgresql.postgresql","authorityLevel":"wazi-reviewed","confidence":0.95,"contentHash":"sha256:bbd3cbb45a19023ce9d9b87ac3d965d5ff7da29ef7c2846b2cd7173a2caae3f7","expiresAt":"2026-11-07T12:16:04Z","extractionMethod":"deterministic-parser","observedAt":"2026-10-31T12:16:04Z","sensitivity":"public","sourceId":"https://github.com/docker-library/postgres/blob/dfc76bb299b057785026eb2eea39556b6fe52983/17/bookworm/Dockerfile","sourceType":"dockerfile","versionScope":"17.11.0+wazi.1"},"requiresCheckpoint":false,"reviewState":"signed","schemaVersion":"1.0.0","signature":{"algorithm":"sigstore-cosign","payloadDigest":"sha256:99d10e0117439ffc710fc2390d96b68934986dcfb5799237edeaf1dec3952f39","signedAt":"2026-10-31T12:16:08Z","signedBy":"wazi-phase1-demo-pilot-20261030","value":"MEYCIQD/dSzr+xMwfuzlGngLHzudb3VyZJnIzVs6Cn6WxMAY1QIhALe2t8xMsZ9faEQXJoinX2QWk4uv4yqzfzgJYyPYnhQd"},"version":"1.0.0"}