{"applicationId":"org.postgresql.postgresql","capabilitySequence":["manifest.verify","compose.pull","compose.up","health.check"],"operation":"upgrade","parameterContracts":[{"capability":"manifest.verify","fixedParameters":{"requireReviewState":"signed"},"requiredParameters":["manifestDigest","requireReviewState"]},{"capability":"compose.pull","fixedParameters":{"imageDigest":"sha256:f1a106ea3b44d85b9baae5e5de9a7fc5bd167cf584b44b5af475bcd42b371acb","service":"postgresql"},"requiredParameters":["service","imageDigest"]},{"capability":"compose.up","fixedParameters":{"service":"postgresql"},"requiredParameters":["service","projectName","composeArtifactDigest"]},{"capability":"health.check","fixedParameters":{"target":"postgresql://local/wazi"},"requiredParameters":["target"]}],"procedureId":"proc_upgrade_postgresql","provenance":{"applicationScope":"org.postgresql.postgresql","authorityLevel":"wazi-reviewed","confidence":0.95,"contentHash":"sha256:bbd3cbb45a19023ce9d9b87ac3d965d5ff7da29ef7c2846b2cd7173a2caae3f7","expiresAt":"2026-11-07T12:16:04Z","extractionMethod":"deterministic-parser","observedAt":"2026-10-31T12:16:04Z","sensitivity":"public","sourceId":"https://github.com/docker-library/postgres/blob/dfc76bb299b057785026eb2eea39556b6fe52983/17/bookworm/Dockerfile","sourceType":"dockerfile","versionScope":"17.11.0+wazi.1"},"requiresCheckpoint":false,"reviewState":"signed","schemaVersion":"1.0.0","signature":{"algorithm":"sigstore-cosign","payloadDigest":"sha256:aa8820c9d57cbd3c0c1c0c9c833562aacefd03709fcb5c3521d48679d87dacc0","signedAt":"2026-10-31T12:16:08Z","signedBy":"wazi-phase1-demo-pilot-20261030","value":"MEQCIEo6Hvua72/P1BR+vXjAOHDbzM1XeXvoE45yysUH55ysAiBKN79FpNK2lbwEouRGA5wYtQrs3GB9YwihsKD4Ct/6WA=="},"version":"1.0.0"}