{"applicationId":"org.gitea.gitea","capabilitySequence":["manifest.verify","volume.restore","volume.restore","compose.up","health.check"],"operation":"restore","parameterContracts":[{"capability":"manifest.verify","requiredParameters":["manifestDigest","requireReviewState"]},{"capability":"volume.restore","requiredParameters":["volume","backupId"]},{"capability":"compose.up","requiredParameters":["service","projectName","composeArtifactDigest"]},{"capability":"health.check","requiredParameters":["target"]}],"procedureId":"proc_gitea_restore_28_2_0","provenance":{"applicationScope":"org.gitea.gitea","authorityLevel":"wazi-reviewed","confidence":1.0,"contentHash":"sha256:3a4e1aa4a885b287effc03e33fc990ddd6ac68364c98203267bc1e7711a534f8","extractionMethod":"deterministic-parser","observedAt":"2026-10-30T19:44:49Z","sensitivity":"public","sourceId":"src_gitea_v28_2_0","sourceType":"container-registry","versionScope":"28.2.0+wazipilot.2"},"requiresCheckpoint":true,"reviewState":"signed","schemaVersion":"1.0.0","signature":{"algorithm":"sigstore-cosign","payloadDigest":"sha256:c9112d983cc4a5a067a6a2019e94381e2308f97bb1f3ddfe00cbf6290cfaee69","signedAt":"2026-10-30T19:44:59Z","signedBy":"wazi-phase1-demo-pilot-20261030","value":"MEQCIAT0IrFWW6ADj34ZeYOdcNQX4ow04dDU+MC6BaSXxfMAAiA1NX8UBf5MbHmkPIavBtp6khYSgvbZOLXGgXMpZTim6A=="},"version":"1.0.0"}