{"applicationId":"com.mysql.mysql","capabilitySequence":["manifest.verify","compose.down"],"operation":"uninstall","parameterContracts":[{"capability":"manifest.verify","fixedParameters":{"requireReviewState":"signed"},"requiredParameters":["manifestDigest","requireReviewState"]},{"capability":"compose.down","fixedParameters":{"removeVolumes":false,"service":"mysql"},"requiredParameters":["service","projectName","removeVolumes"]}],"procedureId":"proc_uninstall_mysql","provenance":{"applicationScope":"com.mysql.mysql","authorityLevel":"wazi-reviewed","confidence":0.95,"contentHash":"sha256:22342d45458ef2e490fe21a169060e2dc765a79931978e241092ecb902427897","expiresAt":"2026-11-07T12:16:09Z","extractionMethod":"deterministic-parser","observedAt":"2026-10-31T12:16:09Z","sensitivity":"public","sourceId":"https://github.com/docker-library/mysql/blob/9b6c81572125a4ff828e3037c71940f3f8311978/8.4/Dockerfile.oracle","sourceType":"dockerfile","versionScope":"8.4.13+wazi.1"},"requiresCheckpoint":false,"reviewState":"signed","schemaVersion":"1.0.0","signature":{"algorithm":"sigstore-cosign","payloadDigest":"sha256:73d0b6c4a57dc1e499fe860fec8bc87baa56f7a1c315b7661a78987fd4d8f0da","signedAt":"2026-10-31T12:16:12Z","signedBy":"wazi-phase1-demo-pilot-20261030","value":"MEYCIQC2QVPbGaOF45z/pG5q+oXylOgw+db2tcwijuJxKJ9hGwIhAPcvjGpdfxXalji1Up2ZubVlQN0hemdNgi5clWwZdbMD"},"version":"1.0.0"}