{"applicationId":"org.gitea.gitea","capabilitySequence":["manifest.verify","volume.backup","volume.backup"],"operation":"backup","parameterContracts":[{"capability":"manifest.verify","requiredParameters":["manifestDigest","requireReviewState"]},{"capability":"volume.backup","requiredParameters":["volume","backupId"]}],"procedureId":"proc_gitea_backup_28_2_0","provenance":{"applicationScope":"org.gitea.gitea","authorityLevel":"wazi-reviewed","confidence":1.0,"contentHash":"sha256:3a4e1aa4a885b287effc03e33fc990ddd6ac68364c98203267bc1e7711a534f8","extractionMethod":"deterministic-parser","observedAt":"2026-10-30T19:44:49Z","sensitivity":"public","sourceId":"src_gitea_v28_2_0","sourceType":"container-registry","versionScope":"28.2.0+wazipilot.2"},"requiresCheckpoint":false,"reviewState":"signed","schemaVersion":"1.0.0","signature":{"algorithm":"sigstore-cosign","payloadDigest":"sha256:d8501887afbaa4690dd68f4804306ccc216e72ce7391b3ff4fe1a3048a201676","signedAt":"2026-10-30T19:44:57Z","signedBy":"wazi-phase1-demo-pilot-20261030","value":"MEYCIQDMDkjFC8d0YNy6tsY2psBNxUQfb+pOrZn9u5jzC/ihZgIhAJWM2PzFbadkX3x5biGGvkArfdmis7SBncbwXZgT95Pj"},"version":"1.0.0"}