{"applicationId":"org.postgresql.postgresql","capabilitySequence":["manifest.verify","health.check","volume.backup","health.check"],"operation":"backup","parameterContracts":[{"capability":"manifest.verify","fixedParameters":{"requireReviewState":"signed"},"requiredParameters":["manifestDigest","requireReviewState"]},{"capability":"health.check","fixedParameters":{"target":"postgresql://local/wazi"},"requiredParameters":["target"]},{"capability":"volume.backup","fixedParameters":{"volume":"data"},"requiredParameters":["volume","backupId"]}],"procedureId":"proc_backup_postgresql","provenance":{"applicationScope":"org.postgresql.postgresql","authorityLevel":"wazi-reviewed","confidence":0.95,"contentHash":"sha256:bbd3cbb45a19023ce9d9b87ac3d965d5ff7da29ef7c2846b2cd7173a2caae3f7","expiresAt":"2026-11-07T12:16:04Z","extractionMethod":"deterministic-parser","observedAt":"2026-10-31T12:16:04Z","sensitivity":"public","sourceId":"https://github.com/docker-library/postgres/blob/dfc76bb299b057785026eb2eea39556b6fe52983/17/bookworm/Dockerfile","sourceType":"dockerfile","versionScope":"17.11.0+wazi.1"},"requiresCheckpoint":false,"reviewState":"signed","schemaVersion":"1.0.0","signature":{"algorithm":"sigstore-cosign","payloadDigest":"sha256:5d92c50fa219933ecb20bae21b54740e8c3e4d6f32ad8c4e288beb1715bc56ca","signedAt":"2026-10-31T12:16:06Z","signedBy":"wazi-phase1-demo-pilot-20261030","value":"MEYCIQDqqpKl7gjFcAsLrRBuHN7ITUEzSQaws3TIj0XwRX7VfgIhAIII37FAuF0mpw4HNXC2SDOiHwe631mk+wMpW+o9c/Xz"},"version":"1.0.0"}