{"applicationId":"org.gitea.gitea","capabilitySequence":["manifest.verify","health.check"],"operation":"health-check","parameterContracts":[{"capability":"manifest.verify","requiredParameters":["manifestDigest","requireReviewState"]},{"capability":"health.check","requiredParameters":["target"]}],"procedureId":"proc_gitea_health_check_28_1_0","provenance":{"applicationScope":"org.gitea.gitea","authorityLevel":"wazi-reviewed","confidence":1.0,"contentHash":"sha256:85f2a98752fd272eca597739a5984cdf1cc50586c9dad889dd8476e69fc3eaf4","extractionMethod":"deterministic-parser","observedAt":"2026-10-30T19:44:49Z","sensitivity":"public","sourceId":"src_gitea_v28_1_0","sourceType":"container-registry","versionScope":"28.1.0+wazipilot.2"},"requiresCheckpoint":false,"reviewState":"signed","schemaVersion":"1.0.0","signature":{"algorithm":"sigstore-cosign","payloadDigest":"sha256:b779e2cb3570586d558d16bd0d6093298d68dbfa1be92060fcd9c76f708acb92","signedAt":"2026-10-30T19:44:54Z","signedBy":"wazi-phase1-demo-pilot-20261030","value":"MEQCIHAjhFAOE0yD+KFbLIyGRyatt7Vc4wX+pN3rYzfJDRSbAiAMJIW7uIosmTGNZE9P1FGmURpKOjw/vyS+nx+sxadHfg=="},"version":"1.0.0"}