{"applicationId":"org.gitea.gitea","capabilitySequence":["manifest.verify","compose.down"],"operation":"uninstall","parameterContracts":[{"capability":"manifest.verify","requiredParameters":["manifestDigest","requireReviewState"]},{"capability":"compose.down","requiredParameters":["service","projectName"]}],"procedureId":"proc_gitea_uninstall_28_2_0","provenance":{"applicationScope":"org.gitea.gitea","authorityLevel":"wazi-reviewed","confidence":1.0,"contentHash":"sha256:3a4e1aa4a885b287effc03e33fc990ddd6ac68364c98203267bc1e7711a534f8","extractionMethod":"deterministic-parser","observedAt":"2026-10-30T19:44:49Z","sensitivity":"public","sourceId":"src_gitea_v28_2_0","sourceType":"container-registry","versionScope":"28.2.0+wazipilot.2"},"requiresCheckpoint":false,"reviewState":"signed","schemaVersion":"1.0.0","signature":{"algorithm":"sigstore-cosign","payloadDigest":"sha256:7fc4a21839d742cfe8de936308923bb515e465146577e7ab3de2fef003c38a55","signedAt":"2026-10-30T19:44:59Z","signedBy":"wazi-phase1-demo-pilot-20261030","value":"MEYCIQCSELqI2qM6Ax5+kCAgkHTrsfRQKkHR55Bni2gUgOv91QIhAObRoRkW6Uf1Ro2/FOOvmKsRuDFO2ZCmT+l8rAxZk04N"},"version":"1.0.0"}